{
  "schema": "pi-ticket-planning:context-manifest:v1",
  "route": "DELIVERY/ADMISSION/REVIEW_IN_PROGRESS",
  "required": [
    "agents/ticket-readiness-reviewer.md",
    "skills/ticket-readiness/SKILL.md"
  ],
  "optional": [],
  "maxBytes": 16000,
  "maxEstimatedTokens": 4000,
  "maxDocuments": 2
}
